{
  "schema_version": "execution-diff/v1",
  "mode": "known-evidence",
  "label": "real",
  "repo": {
    "owner": "garnet-labs",
    "name": "opencode",
    "url": "https://github.com/garnet-labs/opencode"
  },
  "pull_request": {
    "number": 2,
    "url": "https://github.com/garnet-labs/opencode/pull/2",
    "title": "feat(tui): add set-as-default for session model"
  },
  "base": {
    "sha": "d755c10aa8b9b40511582fac869f0858840b1ab8",
    "profile_id": null,
    "run_id": null
  },
  "head": {
    "sha": "867c88cf3cd647da7ff11e7781d8e454ce6ca46e",
    "profile_id": "01a0b58e-31f7-72b9-8460-4d7bf597b276",
    "run_id": "35373924581"
  },
  "comparison": {
    "available": true,
    "scope": "previous-recorded-head-to-head"
  },
  "execution_diff": {
    "processes_added": [],
    "processes_removed": [],
    "network_added": [
      {
        "destination": "glb-p4a577-public-internal.githubapp[.]com (20.75.202.224) (github infra)",
        "section": "runner background",
        "process": null,
        "ancestry": []
      }
    ],
    "network_removed": [
      {
        "destination": "hosted-compute-watchdog-prod-iad-01[.]githubapp (github infra)",
        "section": "runner background",
        "process": null,
        "ancestry": []
      },
      {
        "destination": "glb-2a3c35-public-internal.githubapp[.]com (140.82.113.23) (github infra)",
        "section": "runner background",
        "process": null,
        "ancestry": []
      }
    ],
    "files_added": [],
    "files_removed": [],
    "kinds_recorded": [
      "network"
    ],
    "totals": {
      "execution_chains": 32,
      "destinations": 14,
      "jobs_recorded": 1,
      "jobs_changed": 0,
      "jobs_unchanged": 1,
      "workload": {
        "added": 0,
        "removed": 0
      },
      "runner_background": {
        "added": 1,
        "removed": 2
      }
    }
  },
  "receipt_urls": {
    "base": null,
    "head": "https://app.garnet.ai/public/runs/35373924581?profile=01a0b58e-31f7-72b9-8460-4d7bf597b276",
    "head_json": "https://app.garnet.ai/api/public/runs/35373924581?profile=01a0b58e-31f7-72b9-8460-4d7bf597b276",
    "pr_comment": "https://github.com/garnet-labs/opencode/pull/2#issuecomment-5733577350"
  },
  "recorded": {
    "at": "2026-09-18 17:26:29 UTC",
    "contract": "6.10.0",
    "source": "github-app-comment"
  },
  "pair": {
    "base_sha": "d755c10aa8b9b40511582fac869f0858840b1ab8",
    "head_sha": "867c88cf3cd647da7ff11e7781d8e454ce6ca46e",
    "scope": "previous-recorded-head-to-head",
    "label": "real",
    "transition": null,
    "line": "base d755c10 → head 867c88c · scope previous-recorded-head-to-head · real"
  },
  "capture": {
    "status": "not-declared",
    "expected_cells": null,
    "recorded_cells": null,
    "executed_sha_verified": null,
    "lineage_missing": null,
    "final_record": null,
    "reasons": [
      "the record carries no capture accounting; completeness is not claimed"
    ]
  },
  "verdict": {
    "value": "unchanged",
    "reasons": [
      "no outbound connection was added or removed across the recorded jobs",
      "scope: the recorded jobs only; the record carries no capture accounting"
    ]
  },
  "supersession": {
    "superseded": false,
    "record_head": "867c88cf3cd647da7ff11e7781d8e454ce6ca46e",
    "current_head": "867c88cf3cd647da7ff11e7781d8e454ce6ca46e",
    "reasons": []
  },
  "claims": [
    {
      "class": "observed-runtime-behavior",
      "text": "Recorded on head 867c88c across 1 job: workload outbound connections +0 −0, runner background +1 −2."
    },
    {
      "class": "comparison-result",
      "text": "No new behavior between d755c10 and 867c88c (previous-recorded-head-to-head): no outbound connection was added or removed across the recorded jobs."
    },
    {
      "class": "unsupported-claim",
      "text": "Not carried by this record: compile or build success, file writes outside the recorded file kinds, secret reads, absence of behavior in unrecorded jobs, that nothing else happened."
    }
  ]
}
