{
  "schema_version": "execution-diff/v1",
  "mode": "known-evidence",
  "label": "real",
  "repo": {
    "owner": "garnet-labs",
    "name": "express",
    "url": "https://github.com/garnet-labs/express"
  },
  "pull_request": {
    "number": 4,
    "url": "https://github.com/garnet-labs/express/pull/4",
    "title": "chore(deps): add puppeteer 23.11.1"
  },
  "base": {
    "sha": "098652669930ef3393c2a63fea5eb8a287877b81",
    "profile_id": null,
    "run_id": null
  },
  "head": {
    "sha": "64e565c53424e2fab8e2d94ed8f6f03bf2261b38",
    "profile_id": "01a0f5b8-3f56-7e34-b62d-aa252d78f49c",
    "run_id": "36815162821"
  },
  "comparison": {
    "available": true,
    "scope": "previous-recorded-head-to-head"
  },
  "execution_diff": {
    "processes_added": [],
    "processes_removed": [],
    "network_added": [
      {
        "destination": "storage.googleapis[.]com",
        "section": "workload",
        "process": null,
        "ancestry": []
      },
      {
        "destination": "hosted-compute-watchdog-prod-iad-02[.]githubapp (github infra)",
        "section": "runner background",
        "process": null,
        "ancestry": []
      },
      {
        "destination": "140.82.114.24",
        "section": "runner background",
        "process": null,
        "ancestry": []
      }
    ],
    "network_removed": [
      {
        "destination": "hosted-compute-watchdog-prod-eus-02[.]githubapp (github infra)",
        "section": "runner background",
        "process": null,
        "ancestry": []
      }
    ],
    "files_added": [],
    "files_removed": [],
    "kinds_recorded": [
      "network"
    ],
    "totals": {
      "execution_chains": 19,
      "destinations": 8,
      "jobs_recorded": 1,
      "jobs_changed": 1,
      "jobs_unchanged": 0,
      "workload": {
        "added": 1,
        "removed": 0
      },
      "runner_background": {
        "added": 2,
        "removed": 1
      }
    }
  },
  "receipt_urls": {
    "base": null,
    "head": "https://app.garnet.ai/public/runs/36815162821?profile=01a0f5b8-3f56-7e34-b62d-aa252d78f49c",
    "head_json": "https://app.garnet.ai/api/public/runs/36815162821?profile=01a0f5b8-3f56-7e34-b62d-aa252d78f49c",
    "pr_comment": "https://github.com/garnet-labs/express/pull/4#issuecomment-5924724660"
  },
  "recorded": {
    "at": "2026-10-01 04:28:06 UTC",
    "contract": "6.10.0",
    "source": "github-app-comment"
  },
  "pair": {
    "base_sha": "098652669930ef3393c2a63fea5eb8a287877b81",
    "head_sha": "64e565c53424e2fab8e2d94ed8f6f03bf2261b38",
    "scope": "previous-recorded-head-to-head",
    "label": "real",
    "transition": null,
    "line": "base 0986526 → head 64e565c · scope previous-recorded-head-to-head · real"
  },
  "capture": {
    "status": "not-declared",
    "expected_cells": null,
    "recorded_cells": null,
    "executed_sha_verified": null,
    "lineage_missing": null,
    "final_record": null,
    "reasons": [
      "the record carries no capture accounting; completeness is not claimed"
    ]
  },
  "verdict": {
    "value": "new-behavior",
    "reasons": [
      "1 outbound connection recorded only after the change"
    ]
  },
  "supersession": {
    "superseded": false,
    "record_head": "64e565c53424e2fab8e2d94ed8f6f03bf2261b38",
    "current_head": "64e565c53424e2fab8e2d94ed8f6f03bf2261b38",
    "reasons": []
  },
  "claims": [
    {
      "class": "observed-runtime-behavior",
      "text": "Recorded on head 64e565c across 1 job: workload outbound connections +1 −0, runner background +2 −1."
    },
    {
      "class": "comparison-result",
      "text": "New behavior between 0986526 and 64e565c (previous-recorded-head-to-head): 1 outbound connection recorded only after the change."
    },
    {
      "class": "unsupported-claim",
      "text": "Not carried by this record: compile or build success, file writes outside the recorded file kinds, secret reads, absence of behavior in unrecorded jobs, that nothing else happened."
    }
  ]
}
