{
  "schema_version": "execution-diff/v1",
  "mode": "known-evidence",
  "label": "real",
  "repo": {
    "owner": "garnet-labs",
    "name": "open-swe",
    "url": "https://github.com/garnet-labs/open-swe"
  },
  "pull_request": {
    "number": 24,
    "url": "https://github.com/garnet-labs/open-swe/pull/24",
    "title": "fix(analytics): retain PR revision evidence before comparison"
  },
  "base": {
    "sha": "3f25ab5cbfd5832651ad5cd587a23c74cf64ec8a",
    "profile_id": null,
    "run_id": null
  },
  "head": {
    "sha": "54891ad1d86c0c351fc8a65ed2bb4ad5276459b5",
    "profile_id": "01a0b580-1f78-7c7d-b925-7812ca5a5571",
    "run_id": "35372096479"
  },
  "comparison": {
    "available": true,
    "scope": "previous-recorded-head-to-head"
  },
  "execution_diff": {
    "processes_added": [],
    "processes_removed": [],
    "network_added": [
      {
        "destination": "pypi[.]org",
        "section": "workload",
        "process": null,
        "ancestry": []
      },
      {
        "destination": "140.82.114.24",
        "section": "runner background",
        "process": null,
        "ancestry": []
      },
      {
        "destination": "hosted-compute-watchdog-prod-iad-01[.]githubapp (github infra)",
        "section": "runner background",
        "process": null,
        "ancestry": []
      }
    ],
    "network_removed": [
      {
        "destination": "glb-2a3c35-public-internal.githubapp[.]com (github infra)",
        "section": "runner background",
        "process": null,
        "ancestry": []
      },
      {
        "destination": "hosted-compute-request-orchestrator-prod-iad-02",
        "section": "runner background",
        "process": null,
        "ancestry": []
      }
    ],
    "files_added": [],
    "files_removed": [],
    "kinds_recorded": [
      "network"
    ],
    "totals": {
      "execution_chains": 33,
      "destinations": 14,
      "jobs_recorded": 1,
      "jobs_changed": 1,
      "jobs_unchanged": 0,
      "workload": {
        "added": 1,
        "removed": 0
      },
      "runner_background": {
        "added": 2,
        "removed": 2
      }
    }
  },
  "receipt_urls": {
    "base": null,
    "head": "https://app.garnet.ai/public/runs/35372096479?profile=01a0b580-1f78-7c7d-b925-7812ca5a5571",
    "head_json": "https://app.garnet.ai/api/public/runs/35372096479?profile=01a0b580-1f78-7c7d-b925-7812ca5a5571",
    "pr_comment": "https://github.com/garnet-labs/open-swe/pull/24#issuecomment-5733317385"
  },
  "recorded": {
    "at": "2026-09-18 17:08:26 UTC",
    "contract": "6.10.0",
    "source": "github-app-comment"
  },
  "pair": {
    "base_sha": "3f25ab5cbfd5832651ad5cd587a23c74cf64ec8a",
    "head_sha": "54891ad1d86c0c351fc8a65ed2bb4ad5276459b5",
    "scope": "previous-recorded-head-to-head",
    "label": "real",
    "transition": null,
    "line": "base 3f25ab5 → head 54891ad · scope previous-recorded-head-to-head · real"
  },
  "capture": {
    "status": "not-declared",
    "expected_cells": null,
    "recorded_cells": null,
    "executed_sha_verified": null,
    "lineage_missing": null,
    "final_record": null,
    "reasons": [
      "the record carries no capture accounting; completeness is not claimed"
    ]
  },
  "verdict": {
    "value": "new-behavior",
    "reasons": [
      "1 outbound connection recorded only after the change"
    ]
  },
  "supersession": {
    "superseded": false,
    "record_head": "54891ad1d86c0c351fc8a65ed2bb4ad5276459b5",
    "current_head": "54891ad1d86c0c351fc8a65ed2bb4ad5276459b5",
    "reasons": []
  },
  "claims": [
    {
      "class": "observed-runtime-behavior",
      "text": "Recorded on head 54891ad across 1 job: workload outbound connections +1 −0, runner background +2 −2."
    },
    {
      "class": "comparison-result",
      "text": "New behavior between 3f25ab5 and 54891ad (previous-recorded-head-to-head): 1 outbound connection recorded only after the change."
    },
    {
      "class": "unsupported-claim",
      "text": "Not carried by this record: compile or build success, file writes outside the recorded file kinds, secret reads, absence of behavior in unrecorded jobs, that nothing else happened."
    }
  ]
}
