{
  "schema_version": "execution-diff/v1",
  "mode": "known-evidence",
  "label": "real",
  "repo": {
    "owner": "garnet-labs",
    "name": "express",
    "url": "https://github.com/garnet-labs/express"
  },
  "pull_request": {
    "number": 19,
    "url": "https://github.com/garnet-labs/express/pull/19",
    "title": "chore(deps): add playwright-chromium 1.20.0"
  },
  "base": {
    "sha": "ee8c2fd2485a7692bbb4c36a64be2102294182a5",
    "profile_id": null,
    "run_id": null
  },
  "head": {
    "sha": "2c63c00c2a1531f561fabbeef205aa1ef07881fe",
    "profile_id": "01a0f5c2-7643-7e4d-9f8f-f1dd858a851f",
    "run_id": "36815913968"
  },
  "comparison": {
    "available": true,
    "scope": "previous-recorded-head-to-head"
  },
  "execution_diff": {
    "processes_added": [],
    "processes_removed": [],
    "network_added": [
      {
        "destination": "fg.microsoft.map.fastly[.]net",
        "section": "workload",
        "process": null,
        "ancestry": []
      },
      {
        "destination": "firstparty-azurefd-prod.trafficmanager[.]net",
        "section": "workload",
        "process": null,
        "ancestry": []
      },
      {
        "destination": "glb-p4a577-public-internal.githubapp[.]com (github infra)",
        "section": "runner background",
        "process": null,
        "ancestry": []
      }
    ],
    "network_removed": [
      {
        "destination": "hosted-compute-watchdog-prod-iad-02[.]githubapp (github infra)",
        "section": "runner background",
        "process": null,
        "ancestry": []
      }
    ],
    "files_added": [],
    "files_removed": [],
    "kinds_recorded": [
      "network"
    ],
    "totals": {
      "execution_chains": 20,
      "destinations": 7,
      "jobs_recorded": 1,
      "jobs_changed": 1,
      "jobs_unchanged": 0,
      "workload": {
        "added": 2,
        "removed": 0
      },
      "runner_background": {
        "added": 1,
        "removed": 1
      }
    }
  },
  "receipt_urls": {
    "base": null,
    "head": "https://app.garnet.ai/public/runs/36815913968?profile=01a0f5c2-7643-7e4d-9f8f-f1dd858a851f",
    "head_json": "https://app.garnet.ai/api/public/runs/36815913968?profile=01a0f5c2-7643-7e4d-9f8f-f1dd858a851f",
    "pr_comment": "https://github.com/garnet-labs/express/pull/19#issuecomment-5924815619"
  },
  "recorded": {
    "at": "2026-10-01 04:39:13 UTC",
    "contract": "6.10.0",
    "source": "github-app-comment"
  },
  "pair": {
    "base_sha": "ee8c2fd2485a7692bbb4c36a64be2102294182a5",
    "head_sha": "2c63c00c2a1531f561fabbeef205aa1ef07881fe",
    "scope": "previous-recorded-head-to-head",
    "label": "real",
    "transition": null,
    "line": "base ee8c2fd → head 2c63c00 · scope previous-recorded-head-to-head · real"
  },
  "capture": {
    "status": "not-declared",
    "expected_cells": null,
    "recorded_cells": null,
    "executed_sha_verified": null,
    "lineage_missing": null,
    "final_record": null,
    "reasons": [
      "the record carries no capture accounting; completeness is not claimed"
    ]
  },
  "verdict": {
    "value": "new-behavior",
    "reasons": [
      "2 outbound connections recorded only after the change"
    ]
  },
  "supersession": {
    "superseded": false,
    "record_head": "2c63c00c2a1531f561fabbeef205aa1ef07881fe",
    "current_head": "2c63c00c2a1531f561fabbeef205aa1ef07881fe",
    "reasons": []
  },
  "claims": [
    {
      "class": "observed-runtime-behavior",
      "text": "Recorded on head 2c63c00 across 1 job: workload outbound connections +2 −0, runner background +1 −1."
    },
    {
      "class": "comparison-result",
      "text": "New behavior between ee8c2fd and 2c63c00 (previous-recorded-head-to-head): 2 outbound connections recorded only after the change."
    },
    {
      "class": "unsupported-claim",
      "text": "Not carried by this record: compile or build success, file writes outside the recorded file kinds, secret reads, absence of behavior in unrecorded jobs, that nothing else happened."
    }
  ]
}
