{
  "schema_version": "execution-diff/v1",
  "mode": "known-evidence",
  "label": "real",
  "repo": {
    "owner": "garnet-labs",
    "name": "express",
    "url": "https://github.com/garnet-labs/express"
  },
  "pull_request": {
    "number": 57,
    "url": "https://github.com/garnet-labs/express/pull/57",
    "title": "chore(deps): add onnxruntime-node 1.30.0"
  },
  "base": {
    "sha": "717d41cd4ae98a480a493ae6db8080fb0a012fcb",
    "profile_id": null,
    "run_id": null
  },
  "head": {
    "sha": "c3dcf0aeb0cdbd2ec2ca0fcc49ac363d7ad7a1c6",
    "profile_id": "01a0f5f1-0f44-772d-8e29-712207c08b73",
    "run_id": "36819979447"
  },
  "comparison": {
    "available": true,
    "scope": "previous-recorded-head-to-head"
  },
  "execution_diff": {
    "processes_added": [],
    "processes_removed": [],
    "network_added": [
      {
        "destination": "api.nuget[.]org",
        "section": "workload",
        "process": null,
        "ancestry": []
      },
      {
        "destination": "hosted-compute-watchdog-prod-eus-01[.]githubapp (github infra)",
        "section": "runner background",
        "process": null,
        "ancestry": []
      }
    ],
    "network_removed": [
      {
        "destination": "hosted-compute-watchdog-prod-eus-02[.]githubapp (github infra)",
        "section": "runner background",
        "process": null,
        "ancestry": []
      }
    ],
    "files_added": [],
    "files_removed": [],
    "kinds_recorded": [
      "network"
    ],
    "totals": {
      "execution_chains": 21,
      "destinations": 7,
      "jobs_recorded": 1,
      "jobs_changed": 1,
      "jobs_unchanged": 0,
      "workload": {
        "added": 1,
        "removed": 0
      },
      "runner_background": {
        "added": 1,
        "removed": 1
      }
    }
  },
  "receipt_urls": {
    "base": null,
    "head": "https://app.garnet.ai/public/runs/36819979447?profile=01a0f5f1-0f44-772d-8e29-712207c08b73",
    "head_json": "https://app.garnet.ai/api/public/runs/36819979447?profile=01a0f5f1-0f44-772d-8e29-712207c08b73",
    "pr_comment": "https://github.com/garnet-labs/express/pull/57#issuecomment-5925340652"
  },
  "recorded": {
    "at": "2026-10-01 05:30:09 UTC",
    "contract": "6.10.0",
    "source": "github-app-comment"
  },
  "pair": {
    "base_sha": "717d41cd4ae98a480a493ae6db8080fb0a012fcb",
    "head_sha": "c3dcf0aeb0cdbd2ec2ca0fcc49ac363d7ad7a1c6",
    "scope": "previous-recorded-head-to-head",
    "label": "real",
    "transition": null,
    "line": "base 717d41c → head c3dcf0a · scope previous-recorded-head-to-head · real"
  },
  "capture": {
    "status": "not-declared",
    "expected_cells": null,
    "recorded_cells": null,
    "executed_sha_verified": null,
    "lineage_missing": null,
    "final_record": null,
    "reasons": [
      "the record carries no capture accounting; completeness is not claimed"
    ]
  },
  "verdict": {
    "value": "new-behavior",
    "reasons": [
      "1 outbound connection recorded only after the change"
    ]
  },
  "supersession": {
    "superseded": false,
    "record_head": "c3dcf0aeb0cdbd2ec2ca0fcc49ac363d7ad7a1c6",
    "current_head": "c3dcf0aeb0cdbd2ec2ca0fcc49ac363d7ad7a1c6",
    "reasons": []
  },
  "claims": [
    {
      "class": "observed-runtime-behavior",
      "text": "Recorded on head c3dcf0a across 1 job: workload outbound connections +1 −0, runner background +1 −1."
    },
    {
      "class": "comparison-result",
      "text": "New behavior between 717d41c and c3dcf0a (previous-recorded-head-to-head): 1 outbound connection recorded only after the change."
    },
    {
      "class": "unsupported-claim",
      "text": "Not carried by this record: compile or build success, file writes outside the recorded file kinds, secret reads, absence of behavior in unrecorded jobs, that nothing else happened."
    }
  ]
}
