{
  "schema_version": "execution-diff/v1",
  "mode": "known-evidence",
  "label": "real",
  "repo": {
    "owner": "garnet-labs",
    "name": "express",
    "url": "https://github.com/garnet-labs/express"
  },
  "pull_request": {
    "number": 54,
    "url": "https://github.com/garnet-labs/express/pull/54",
    "title": "chore(deps): add faiss-node 0.5.1"
  },
  "base": {
    "sha": "717d41cd4ae98a480a493ae6db8080fb0a012fcb",
    "profile_id": null,
    "run_id": null
  },
  "head": {
    "sha": "b0779f291ccd72235163076127b526fa5da4b5ce",
    "profile_id": "01a0f5f0-f9b0-7907-b61a-208adbff2859",
    "run_id": "36819978011"
  },
  "comparison": {
    "available": true,
    "scope": "previous-recorded-head-to-head"
  },
  "execution_diff": {
    "processes_added": [],
    "processes_removed": [],
    "network_added": [
      {
        "destination": "github[.]com",
        "section": "workload",
        "process": null,
        "ancestry": []
      },
      {
        "destination": "release-assets.githubusercontent[.]com",
        "section": "workload",
        "process": null,
        "ancestry": []
      },
      {
        "destination": "hosted-compute-watchdog-prod-eus-02[.]githubapp (github infra)",
        "section": "runner background",
        "process": null,
        "ancestry": []
      }
    ],
    "network_removed": [
      {
        "destination": "hosted-compute-watchdog-prod-iad-02[.]githubapp (github infra)",
        "section": "runner background",
        "process": null,
        "ancestry": []
      }
    ],
    "files_added": [],
    "files_removed": [],
    "kinds_recorded": [
      "network"
    ],
    "totals": {
      "execution_chains": 17,
      "destinations": 8,
      "jobs_recorded": 1,
      "jobs_changed": 1,
      "jobs_unchanged": 0,
      "workload": {
        "added": 2,
        "removed": 0
      },
      "runner_background": {
        "added": 1,
        "removed": 1
      }
    }
  },
  "receipt_urls": {
    "base": null,
    "head": "https://app.garnet.ai/public/runs/36819978011?profile=01a0f5f0-f9b0-7907-b61a-208adbff2859",
    "head_json": "https://app.garnet.ai/api/public/runs/36819978011?profile=01a0f5f0-f9b0-7907-b61a-208adbff2859",
    "pr_comment": "https://github.com/garnet-labs/express/pull/54#issuecomment-5925339437"
  },
  "recorded": {
    "at": "2026-10-01 05:30:05 UTC",
    "contract": "6.10.0",
    "source": "github-app-comment"
  },
  "pair": {
    "base_sha": "717d41cd4ae98a480a493ae6db8080fb0a012fcb",
    "head_sha": "b0779f291ccd72235163076127b526fa5da4b5ce",
    "scope": "previous-recorded-head-to-head",
    "label": "real",
    "transition": null,
    "line": "base 717d41c → head b0779f2 · scope previous-recorded-head-to-head · real"
  },
  "capture": {
    "status": "not-declared",
    "expected_cells": null,
    "recorded_cells": null,
    "executed_sha_verified": null,
    "lineage_missing": null,
    "final_record": null,
    "reasons": [
      "the record carries no capture accounting; completeness is not claimed"
    ]
  },
  "verdict": {
    "value": "new-behavior",
    "reasons": [
      "2 outbound connections recorded only after the change"
    ]
  },
  "supersession": {
    "superseded": false,
    "record_head": "b0779f291ccd72235163076127b526fa5da4b5ce",
    "current_head": "b0779f291ccd72235163076127b526fa5da4b5ce",
    "reasons": []
  },
  "claims": [
    {
      "class": "observed-runtime-behavior",
      "text": "Recorded on head b0779f2 across 1 job: workload outbound connections +2 −0, runner background +1 −1."
    },
    {
      "class": "comparison-result",
      "text": "New behavior between 717d41c and b0779f2 (previous-recorded-head-to-head): 2 outbound connections recorded only after the change."
    },
    {
      "class": "unsupported-claim",
      "text": "Not carried by this record: compile or build success, file writes outside the recorded file kinds, secret reads, absence of behavior in unrecorded jobs, that nothing else happened."
    }
  ]
}
